{
  "contract": "quiltor.manuscript",
  "version": 1,
  "revision": 7,
  "payload": {
    "chapters": [
      {
        "id": "chapter-arrival",
        "title": "Die Ankunft",
        "body": "Mara öffnete die Karte.",
        "note": "Die Unruhe nur andeuten.",
        "noteReferences": [
          {
            "id": "note-reference-unruhe",
            "target": { "kind": "entity", "id": "mara" },
            "from": 4,
            "to": 10,
            "surface": "Unruhe"
          }
        ],
        "noteMarks": [
          { "from": 0, "to": 24, "kind": "heading", "level": 2 },
          { "from": 4, "to": 10, "kind": "bold" }
        ],
        "storyTime": {
          "startMomentId": "arrival",
          "endMomentId": "departure",
          "extensionLabel": "The nested record also preserves extensions."
        },
        "mentions": [
          {
            "id": "mention-mara-1",
            "elementId": "mara",
            "from": 0,
            "to": 4,
            "surface": "Mara",
            "source": "deterministic",
            "confidence": 1
          }
        ],
        "marks": [{ "from": 5, "to": 12, "kind": "italic" }],
        "extensionNote": "Unknown chapter properties survive a round trip."
      }
    ],
    "trash": [
      {
        "chapter": {
          "id": "chapter-deleted-draft",
          "inBook": false,
          "title": "Verworfener Prolog",
          "body": "Mara fand die Karte früher.",
          "note": ""
        },
        "deletedAt": "2026-09-19T10:00:00.000Z",
        "originalFolderPath": [
          {
            "id": "folder-prologue",
            "title": "Entwürfe",
            "extensionColor": "blue"
          }
        ],
        "treeItem": {
          "id": "tree-deleted-draft",
          "kind": "chapter",
          "chapterId": "chapter-deleted-draft",
          "parentFolderId": "folder-prologue",
          "position": 0,
          "extensionPlacement": "kept"
        },
        "extensionReason": "alternate opening"
      }
    ],
    "bookLayout": {
      "version": 1,
      "preset": "quiltor-novel",
      "pageFormat": "6x9",
      "pageWidthMm": 152.4,
      "pageHeightMm": 228.6,
      "marginInnerMm": 19.812,
      "marginOuterMm": 17.272,
      "marginTopMm": 18.288,
      "marginBottomMm": 20.828,
      "gutterMm": 0,
      "mirrorMargins": true,
      "fontFamily": "eb-garamond",
      "fontSizePt": 10.75,
      "lineHeight": 1.54,
      "alignment": "justify",
      "hyphenation": true,
      "firstLineIndent": true,
      "firstLineIndentEm": 1.22,
      "paragraphSpacingEm": 0,
      "widows": 3,
      "orphans": 3,
      "chapterStart": "right-page",
      "chapterTopMm": 22.352,
      "chapterNumber": true,
      "chapterNumberStyle": "padded",
      "chapterTitle": true,
      "chapterAlignment": "center",
      "chapterTitleSizePt": 18,
      "dropCap": true,
      "chapterFirstIndent": false,
      "sceneSymbol": "⁂",
      "sceneSpaceBeforeMm": 6.985,
      "sceneSpaceAfterMm": 6.985,
      "pageNumbers": true,
      "pageNumberPosition": "bottom-center",
      "hideChapterPageNumbers": false,
      "hideTitlePageNumber": true,
      "numberFromFirstChapter": false,
      "bookTitle": "Die Karten des Nordens",
      "subtitle": "",
      "author": "Mara Beispiel",
      "series": "",
      "volume": "",
      "showNovelLabel": true,
      "showVersion": true,
      "showDate": true,
      "extensionTypography": { "kept": true }
    },
    "structure": {
      "folders": [{ "id": "part-one", "title": "Teil I" }],
      "items": [
        { "id": "tree-part-one", "kind": "folder", "folderId": "part-one", "position": 0 },
        {
          "id": "tree-chapter-arrival",
          "kind": "chapter",
          "chapterId": "chapter-arrival",
          "parentFolderId": "part-one",
          "position": 0
        }
      ]
    },
    "language": "de-DE",
    "grammarMode": "manual",
    "words": ["Gezeitenarchiv", { "w": "Arcène", "d": "Ort" }],
    "activeSymbols": ["„", "“", "…"],
    "extension": { "source": "contract-fixture" }
  }
}
